{
  "problem_id": "2024_C",
  "assumptions": [
    {
      "id": "A1",
      "statement": "耕地面积固定，作物间可轮作",
      "justification": "题面设定"
    },
    {
      "id": "A2",
      "statement": "市场需求和价格可预测",
      "justification": "题面给定数据"
    }
  ],
  "variables": [
    {
      "id": "x_i",
      "name": "作物 i 种植面积",
      "description": "决策变量",
      "unit": "亩",
      "role": "decision",
      "domain": "x_i ≥ 0"
    },
    {
      "id": "R",
      "name": "总收益",
      "description": "销售收入减成本",
      "unit": "yuan",
      "role": "derived",
      "domain": "R ≥ 0"
    }
  ],
  "parameters": [
    {
      "id": "p1",
      "name": "各作物单位面积收益 r_i",
      "value_or_source": "题目给定",
      "unit": "yuan/亩",
      "source": "data"
    },
    {
      "id": "p2",
      "name": "总耕地面积 A",
      "value_or_source": "题目给定",
      "unit": "亩",
      "source": "data"
    }
  ],
  "constraints": [
    {
      "id": "C1",
      "expression": "Σx_i ≤ A",
      "rationale": "耕地面积约束"
    },
    {
      "id": "C2",
      "expression": "x_i ≥ 0",
      "rationale": "非负约束"
    }
  ],
  "objective": [
    {
      "id": "O1",
      "expression": "max R = Σ r_i · x_i",
      "kind": "maximize",
      "rationale": "总收益最大"
    }
  ],
  "mechanism": [
    {
      "id": "M1",
      "name": "收益计算",
      "equation": "R = Σ r_i · x_i",
      "derivation_notes": "线性收益"
    }
  ],
  "candidate_models": [
    {
      "model": "线性规划",
      "pros": "简单高效",
      "cons": "忽略不确定性"
    },
    {
      "model": "随机规划",
      "pros": "考虑价格波动",
      "cons": "需要分布信息"
    }
  ],
  "selected_model": "线性规划",
  "selection_reason": "基础模型适用 LP",
  "uncertainties": [],
  "sensitivity_plan": [],
  "problem_interpretation": "在有限耕地资源下，建立多目标优化模型制定最优种植策略，考虑收益、风险和可持续性权衡。"
}